{
  "schema_version": "2.0.0",
  "metadata": {
    "generated_at": "2026-10-13T15:10:20.511401+00:00",
    "as_of": "2026-10-02T00:00:00+00:00",
    "measurement_period_start": "2026-09-01T05:11:04+00:00",
    "measurement_period_end": "2026-09-30T23:50:01+00:00",
    "is_demonstration_mode": true,
    "disclaimer": "DEMONSTRATION NOTICE: Figures in this report are generated from synthetic test records and simulated models for accountability demonstration purposes only. They do NOT reflect genuine platform performance or real law enforcement investigations.",
    "k_anonymity_threshold": 10,
    "total_requests_analyzed": 300
  },
  "overall_performance": {
    "total_takedown_requests": 225,
    "eligible_takedown_requests": 210,
    "mature_takedown_requests": 210,
    "completed_takedowns": 165,
    "rejections_count": 10,
    "rejection_rate_pct": 4.76,
    "median_removal_hours": 17.42,
    "median_removal_censored": false,
    "median_removal_display": "17.4h",
    "p90_removal_hours": null,
    "p90_removal_censored": true,
    "p90_removal_display": "> measurement window",
    "deadline_compliance_rate_pct": 23.5,
    "still_available_rate_pct": 17.5,
    "total_data_requests": 75,
    "median_data_response_hours": 49.94,
    "p90_data_response_hours": 92.96,
    "incomplete_police_requests_count": 19,
    "invalid_records_count": 0,
    "false_removal_claims_count": 12,
    "observed_reuploads_count": 0,
    "verified_takedowns_count": 163
  },
  "platform_breakdown": [
    {
      "platform": "Platform A",
      "is_suppressed": false,
      "sample_size": 22,
      "median_removal_hours": 6.89,
      "median_removal_censored": false,
      "median_removal_display": "6.9h",
      "p90_removal_hours": 21.09,
      "p90_removal_censored": false,
      "p90_removal_display": "21.1h",
      "deadline_compliance_rate_pct": 26.67,
      "still_available_rate_pct": 6.67,
      "rejections_count": null,
      "rejection_rate_pct": null,
      "median_data_response_hours": null,
      "incomplete_requests_count": 0,
      "suppression_reason": null,
      "false_removal_claims_count": 1,
      "observed_reuploads_count": 0,
      "verified_takedowns_count": 14
    },
    {
      "platform": "Platform B",
      "is_suppressed": false,
      "sample_size": 27,
      "median_removal_hours": 6.21,
      "median_removal_censored": false,
      "median_removal_display": "6.2h",
      "p90_removal_hours": null,
      "p90_removal_censored": true,
      "p90_removal_display": "> measurement window",
      "deadline_compliance_rate_pct": 46.67,
      "still_available_rate_pct": 13.33,
      "rejections_count": 0,
      "rejection_rate_pct": 0.0,
      "median_data_response_hours": null,
      "incomplete_requests_count": null,
      "suppression_reason": null,
      "false_removal_claims_count": 1,
      "observed_reuploads_count": 0,
      "verified_takedowns_count": 13
    },
    {
      "platform": "Platform C",
      "is_suppressed": false,
      "sample_size": 35,
      "median_removal_hours": 13.52,
      "median_removal_censored": false,
      "median_removal_display": "13.5h",
      "p90_removal_hours": null,
      "p90_removal_censored": true,
      "p90_removal_display": "> measurement window",
      "deadline_compliance_rate_pct": 15.0,
      "still_available_rate_pct": 20.0,
      "rejections_count": 0,
      "rejection_rate_pct": 0.0,
      "median_data_response_hours": 40.25,
      "incomplete_requests_count": null,
      "suppression_reason": null,
      "false_removal_claims_count": 2,
      "observed_reuploads_count": 0,
      "verified_takedowns_count": 16
    },
    {
      "platform": "Platform D",
      "is_suppressed": false,
      "sample_size": 28,
      "median_removal_hours": 12.49,
      "median_removal_censored": false,
      "median_removal_display": "12.5h",
      "p90_removal_hours": null,
      "p90_removal_censored": true,
      "p90_removal_display": "> measurement window",
      "deadline_compliance_rate_pct": 15.79,
      "still_available_rate_pct": 21.05,
      "rejections_count": null,
      "rejection_rate_pct": null,
      "median_data_response_hours": null,
      "incomplete_requests_count": null,
      "suppression_reason": null,
      "false_removal_claims_count": 2,
      "observed_reuploads_count": 0,
      "verified_takedowns_count": 15
    },
    {
      "platform": "Platform E",
      "is_suppressed": false,
      "sample_size": 25,
      "median_removal_hours": 6.05,
      "median_removal_censored": false,
      "median_removal_display": "6.0h",
      "p90_removal_hours": 49.92,
      "p90_removal_censored": false,
      "p90_removal_display": "49.9h",
      "deadline_compliance_rate_pct": 18.75,
      "still_available_rate_pct": 6.25,
      "rejections_count": null,
      "rejection_rate_pct": null,
      "median_data_response_hours": null,
      "incomplete_requests_count": null,
      "suppression_reason": null,
      "false_removal_claims_count": 0,
      "observed_reuploads_count": 0,
      "verified_takedowns_count": 15
    },
    {
      "platform": "Platform F",
      "is_suppressed": false,
      "sample_size": 33,
      "median_removal_hours": 21.67,
      "median_removal_censored": false,
      "median_removal_display": "21.7h",
      "p90_removal_hours": 70.05,
      "p90_removal_censored": false,
      "p90_removal_display": "70.0h",
      "deadline_compliance_rate_pct": 22.73,
      "still_available_rate_pct": 9.09,
      "rejections_count": 0,
      "rejection_rate_pct": 0.0,
      "median_data_response_hours": null,
      "incomplete_requests_count": null,
      "suppression_reason": null,
      "false_removal_claims_count": 0,
      "observed_reuploads_count": 0,
      "verified_takedowns_count": 20
    },
    {
      "platform": "Platform G",
      "is_suppressed": false,
      "sample_size": 32,
      "median_removal_hours": 32.0,
      "median_removal_censored": false,
      "median_removal_display": "32.0h",
      "p90_removal_hours": null,
      "p90_removal_censored": true,
      "p90_removal_display": "> measurement window",
      "deadline_compliance_rate_pct": 20.0,
      "still_available_rate_pct": 32.0,
      "rejections_count": 0,
      "rejection_rate_pct": 0.0,
      "median_data_response_hours": null,
      "incomplete_requests_count": null,
      "suppression_reason": null,
      "false_removal_claims_count": 1,
      "observed_reuploads_count": 0,
      "verified_takedowns_count": 16
    },
    {
      "platform": "Platform H",
      "is_suppressed": false,
      "sample_size": 29,
      "median_removal_hours": 44.09,
      "median_removal_censored": false,
      "median_removal_display": "44.1h",
      "p90_removal_hours": null,
      "p90_removal_censored": true,
      "p90_removal_display": "> measurement window",
      "deadline_compliance_rate_pct": 15.0,
      "still_available_rate_pct": 25.0,
      "rejections_count": null,
      "rejection_rate_pct": null,
      "median_data_response_hours": null,
      "incomplete_requests_count": null,
      "suppression_reason": null,
      "false_removal_claims_count": 0,
      "observed_reuploads_count": 0,
      "verified_takedowns_count": 15
    },
    {
      "platform": "Platform I",
      "is_suppressed": false,
      "sample_size": 31,
      "median_removal_hours": 12.33,
      "median_removal_censored": false,
      "median_removal_display": "12.3h",
      "p90_removal_hours": 24.66,
      "p90_removal_censored": false,
      "p90_removal_display": "24.7h",
      "deadline_compliance_rate_pct": 36.84,
      "still_available_rate_pct": 0.0,
      "rejections_count": null,
      "rejection_rate_pct": null,
      "median_data_response_hours": null,
      "incomplete_requests_count": null,
      "suppression_reason": null,
      "false_removal_claims_count": 0,
      "observed_reuploads_count": 0,
      "verified_takedowns_count": 18
    },
    {
      "platform": "Platform J",
      "is_suppressed": false,
      "sample_size": 38,
      "median_removal_hours": 24.92,
      "median_removal_censored": false,
      "median_removal_display": "24.9h",
      "p90_removal_hours": null,
      "p90_removal_censored": true,
      "p90_removal_display": "> measurement window",
      "deadline_compliance_rate_pct": 24.14,
      "still_available_rate_pct": 27.59,
      "rejections_count": null,
      "rejection_rate_pct": null,
      "median_data_response_hours": null,
      "incomplete_requests_count": null,
      "suppression_reason": null,
      "false_removal_claims_count": 5,
      "observed_reuploads_count": 0,
      "verified_takedowns_count": 21
    }
  ],
  "category_breakdown": [
    {
      "category": "CSAM",
      "is_suppressed": false,
      "sample_size": 30,
      "median_removal_hours": 8.57,
      "median_removal_censored": false,
      "median_removal_display": "8.6h",
      "p90_removal_hours": 52.09,
      "p90_removal_censored": false,
      "p90_removal_display": "52.1h",
      "deadline_compliance_rate_pct": 10.53,
      "suppression_reason": null
    },
    {
      "category": "FinancialFraud",
      "is_suppressed": false,
      "sample_size": 27,
      "median_removal_hours": 20.44,
      "median_removal_censored": false,
      "median_removal_display": "20.4h",
      "p90_removal_hours": 35.03,
      "p90_removal_censored": false,
      "p90_removal_display": "35.0h",
      "deadline_compliance_rate_pct": 33.33,
      "suppression_reason": null
    },
    {
      "category": "Impersonation",
      "is_suppressed": false,
      "sample_size": 28,
      "median_removal_hours": 16.33,
      "median_removal_censored": false,
      "median_removal_display": "16.3h",
      "p90_removal_hours": null,
      "p90_removal_censored": true,
      "p90_removal_display": "> measurement window",
      "deadline_compliance_rate_pct": 31.25,
      "suppression_reason": null
    },
    {
      "category": "NonConsensualImagery",
      "is_suppressed": false,
      "sample_size": 42,